{
  "treaty": "旨在廢除死刑的公民權利和政治權利國際公約第二項任擇議定書",
  "treaty_zh": "旨在廢除死刑的公民權利和政治權利國際公約第二項任擇議定書",
  "treaty_en": "Second Optional Protocol to the International Covenant on Civil and Political Rights, Aiming at the Abolition of the Death Penalty",
  "total_articles": 11,
  "preamble_zh": "本議定書締約國，認爲廢除死刑有助於提高人的尊嚴和促使人權的持續發展，回顧1948年12月10日通過的《世界人權宣言》的第三條和1966年12月16日通過的《公民權利和政治權利國際公約》的第六條，注意到《公民權利和政治權利國際公約》第六條提到廢除死刑所用的措詞強烈暗示廢除死刑是可取的，深信廢除死刑的所有措施應被視爲是在享受生命方面的進步，切望在此對廢除死刑作出國際承諾，茲議定如下",
  "preamble_en": "The States Parties to the present Protocol,Believing that abolition of the death penalty contributes toenhancement of human dignity and progressive development of humanrights,Recalling article 3 of the Universal Declaration of Human Rights,adopted on 10 December 1948, and article 6 of the InternationalCovenant on Civil and Political Rights, adopted on 16 December1966,Noting that article 6 of the International Covenant on Civiland Political Rights refers to abolition of the death penaltyin terms that strongly suggest that abolition is desirable,Convinced that all measures of abolition of the death penaltyshould be considered as progress in the enjoyment of the rightto life,Desirous to undertake hereby an international commitment toabolish the death penalty,Have agreed as follows:",
  "articles": [
    {
      "article": "一",
      "title_zh": "",
      "title_en": "",
      "content_zh": "1. 在本議定書締約國管轄範圍內，任何人不得被處死刑。\n\n2. 每一締約國應採取一切必要措施在其管轄範圍內廢除死刑。",
      "content_en": "1. No one within the jurisdiction of a State Party to the presentProtocol shall be executed.\n2. Each State Party shall take all necessary measures to abolishthe death penalty within its jurisdiction."
    },
    {
      "article": "二",
      "title_zh": "",
      "title_en": "",
      "content_zh": "1. 本議定書不接受任何保留，唯在批准或加入時可提出這樣一項保留：即規定在戰時可對在戰時犯下最嚴重軍事性罪行被判罪的人適用死刑。\n\n2. 提出這項保留的締約國在批准或加入時應向聯合國秘書長遞交在戰時適用的本國法律有關規定。\n\n3. 提出這項保留的締約國應把適用於其本國領土的任何戰爭狀態的開始或結束通知秘書長。",
      "content_en": "1. No reservation is admissible to the present Protocol, exceptfor a reservation made at the time of ratification or accessionthat provides for the application of the death penalty in timeof war pursuant to a conviction for a most serious crime of amilitary nature committed during wartime.\n2. The State Party making such a reservation shall at the timeof ratification or accession communicate to the Secretary-Generalof the United Nations the relevant provisions of its nationallegislation applicable during wartime.\n3. The State Party having made such a reservation shall notifythe Secretary-General of the United Nations of any beginning orending of a state of war applicable to its territory."
    },
    {
      "article": "三",
      "title_zh": "",
      "title_en": "",
      "content_zh": "本議定書締約國應在其按照公約第40條的規定向人權事務委員會提交的報告中載列它們為實施本議定書而採取的措施的資料。",
      "content_en": "The States Parties to the present Protocol shall include inthe reports they submit to the Human Rights Committee, in accordancewith article 40 of the Covenant, information on the measures thatthey have adopted to give effect to the present Protocol."
    },
    {
      "article": "四",
      "title_zh": "",
      "title_en": "",
      "content_zh": "對於按照公約第41條作出宣告的締約國，人權事務委員會關於接受和審議締約國聲稱另一締約國不履行其義務的來文的許可權，應擴大以包括本議定書的各項規定，除非有關締約國在批准或加入時作出相反的宣告。",
      "content_en": "With respect to the States Parties to the Covenant that havemade a declaration under article 41, the competence of the HumanRights Committee to receive and consider communications when aState Party claims that another State Party is not fulfillingits obligations shall extend to the provisions of the presentProtocol, unless the State Party concerned has made a statementto the contrary at the moment of ratification or accession."
    },
    {
      "article": "五",
      "title_zh": "",
      "title_en": "",
      "content_zh": "對於1966年12月16日透過的《公民及政治權利國際公約》第一項任擇議定書的締約國，人權事務委員會關於接受和審議受有關國家管轄的個人的來文的許可權，應擴大以包括本議定書的各項規定，除非有關締約國在批准或加入時作出相反的宣告。",
      "content_en": "With respect to the States Parties to the first Optional Protocolto the International Covenant on Civil and Political Rights adoptedon 16 December 1966, the competence of the Human Rights Committeeto receive and consider communications from individuals subjectto its jurisdiction shall extend to the provisions of the presentProtocol, unless the State Party concerned has made a statementto the contrary at the moment of ratification or accession."
    },
    {
      "article": "六",
      "title_zh": "",
      "title_en": "",
      "content_zh": "1. 本議定書的規定應作為公約的附加規定予以適用。\n\n2. 在不妨害可能根據本議定書第2條提出保留的條件下，本議定書第1條第1款所保證的權利不應受到公約第4條的任何克減。",
      "content_en": "1. The provisions of the present Protocol shall apply as additionalprovisions to the Covenant.\n2. Without prejudice to the possibility of a reservation underarticle 2 of the present Protocol, the right guaranteed in article1, paragraph 1, of the present Protocol shall not be subject toany derogation under article 4 of the Covenant."
    },
    {
      "article": "七",
      "title_zh": "",
      "title_en": "",
      "content_zh": "1. 本議定書開放給業已簽署公約的國家簽字。\n\n2. 本議定書須經業已批准或加入公約的國家批准。批准書應交存聯合國秘書長。\n\n3. 本議定書開放給業已批准或加入公約的國家加入。\n\n4. 加入時應向聯合國秘書長交存加入書。\n\n5. 聯合國秘書長應將每一批准書或加入書的交存通知業已簽署或加入本議定書的所有國家。",
      "content_en": "1. The present Protocol is open for signature by any Statethat has signed the Covenant. 2. The present Protocol is subjectto ratification by any State that has ratified the Covenant oracceded to it. Instruments of ratification shall be depositedwith the Secretary-General of the United Nations.\n3. The present Protocol shall be open to accession by any Statethat has ratified the Covenant or acceded to it.\n4. Accession shall be effected by the deposit of an instrumentof accession with the Secretary-General of the United Nations.\n5. The Secretary-General of the United Nations shall informall States that have signed the present Protocol or acceded toit of the deposit of each instrument of ratification or accession."
    },
    {
      "article": "八",
      "title_zh": "",
      "title_en": "",
      "content_zh": "1. 本議定書應於第十件批准書或加入書交存聯合國秘書長之日起三個月後發生效力。\n\n2. 對於第十件批准書或加入書交存後批准或加入本議定書的國家，本議定書應自該國交存批准書或加入書之日起三個月後發生效力。",
      "content_en": "1. The present Protocol shall enter into force three monthsafter the date of the deposit with the Secretary-General of theUnited Nations of the tenth instrument of ratification or accession.\n2. For each State ratifying the present Protocol or accedingto it after the deposit of the tenth instrument of ratificationor accession, the present Protocol shall enter into force threemonths after the date of the deposit of its own instrument ofratification or accession."
    },
    {
      "article": "九",
      "title_zh": "",
      "title_en": "",
      "content_zh": "本議定書各項規定應一律適用於聯邦國家的全部領土並無限制或例外。",
      "content_en": "The provisions of the present Protocol shall extend to allparts of federal States without any limitations or exceptions."
    },
    {
      "article": "十",
      "title_zh": "",
      "title_en": "",
      "content_zh": "聯合國秘書長應將下列事項通知公約第48條第1款所稱的所有國家：\n\n(a) 根據本議定書第2條提出的保留意見、來文和通知；\n\n(b) 根據本議定書第4或第5條提出的宣告；\n\n(c) 根據本議定書第8條所作的簽署、批准和加入；\n\n(d) 根據本議定書第8條本議定書發生效力的日期。",
      "content_en": "The Secretary-General of the United Nations shall inform allStates referred to in article 48, paragraph 1, of the Covenantof the following particulars:(a) Reservations, communications and notifications under article2 of the present Protocol;(b) Statements made under articles 4 or 5 of the present Protocol;(c) Signatures, ratifications and accessions under article7 of the present Protocol:(d) The date of the entry into force of the present Protocolunder article 8 thereof."
    },
    {
      "article": "十一",
      "title_zh": "",
      "title_en": "",
      "content_zh": "1. 本議定書應交存聯合國檔案庫，其阿拉伯文、中文、英文、法文、俄文和西班牙文各本同一作準。\n\n2. 聯合國秘書長應將本議定書正式副本分送公約第48條所稱的所有國家。",
      "content_en": "1. The present Protocol, of which the Arabic, Chinese, English,French, Russian and Spanish texts are equally authentic, shallbe deposited in the archives of the United Nations.\n2. The Secretary-General of the United Nations shall transmitcertified copies of the present Protocol to all States referredto in article 48 of the Covenant."
    }
  ]
}